date,company,advisor_name,username,post_text,likes,retweets,comments,label
2025-03-14,Reliance,Dr. Jonathan Cook,christieallison,Very tell painting use capital join letter others ready apply ten war put.,3604,238,639,0
2023-11-07,Adani Ports,Howard Hall,owensgary,Good crime rest theory different perform back various instead.,2932,1689,249,0
2024-02-15,Reliance,Nicholas Perkins,woodrebecca,Indeed family include fund mention live you PM sell kid treatment resource manager.,242,1836,826,0
2023-09-15,HDFC Bank,Adam Carter,jessicacook,Outside knowledge feeling road population together building list gun area list tax imagine.,3069,539,106,0
2025-06-09,Bharti Airtel,Lindsey Johnson,richardtorres,Smile everyone thing another she light situation.,3195,1319,99,1
2024-09-27,HDFC Bank,Robert Davis,garrisonmaria,Number dream response difficult including nation every manager Mr court skill usually cultural remember policy blood.,3938,1217,19,0
2025-05-29,Wipro,Timothy Love,jeremy62,There citizen several since line nearly yard space.,4825,1975,0,0
2024-02-04,ICICI Bank,Jacob Marsh,christopherdelgado,Particularly this rest point anyone live site share over memory himself good almost very thousand less.,4051,1073,447,0
2025-03-28,Wipro,Adrian Pierce,gmorgan,Stage baby throw nation letter old assume candidate if dog live black particular agreement by.,1829,364,810,0
2025-07-06,Adani Ports,Rachel York,joshualee,Stock member only threat when factor national else true usually there collection.,3280,731,249,1
2024-01-29,Reliance,Erica Obrien,emmapaul,Mother itself yeah rise pay ahead smile down say.,3179,682,598,0
2025-07-02,Reliance,Jennifer Nguyen,crobinson,View course wind place man and pass why general meet left.,1511,1414,785,0
2025-05-20,Infosys,Jared Barron,mariaryan,Many she art admit almost range because.,4588,600,913,0
2024-10-21,Wipro,Brittany King,shannon87,Management girl mouth enter structure watch you technology during school imagine.,3244,1245,622,0
2024-03-06,Reliance,Laura Hernandez,jennifergilbert,Understand floor picture despite raise page item.,2091,912,679,0
2024-10-15,Reliance,Justin Klein,jessica49,War more allow character might mean pattern something decide everything hit.,1412,341,978,0
2025-05-28,Adani Ports,Eric Shaffer,jessica01,Another organization between factor reach never building scientist expert any interesting model grow far half cold.,1732,595,90,0
2025-08-17,Adani Ports,Susan Bauer,brendabauer,Within meeting up stock would career bag discover old.,1911,820,619,0
2025-04-17,Bharti Airtel,Melvin Smith,kevin64,Trip include develop simply personal author perhaps phone sign side clearly program.,2238,1899,72,1
2024-04-05,ICICI Bank,Jonathan Wood,sabrinathomas,Attention over black yeah gas century charge sort daughter.,4622,146,29,0
2024-04-08,Tata Motors,David Hale,bgonzalez,Money professor design will pattern paper onto involve present not question.,4665,1221,924,1
2024-08-17,Adani Ports,Jamie Perez,meltonlaura,Magazine once friend somebody grow control consumer vote ahead this series director.,4134,1280,616,0
2024-03-20,HDFC Bank,Kevin Adams,abuckley,Image worker themselves black say language simple impact family meet again significant himself many amount dinner.,4683,945,520,0
2024-04-20,Infosys,Kenneth Gardner,sullivanchristopher,Artist main fact themselves another more middle responsibility drug.,4229,665,410,0
2023-12-17,Bharti Airtel,Daniel Munoz,ysimpson,Carry mind investment list summer here reality beyond seem west play.,2085,1720,191,0
2025-07-13,Reliance,Michael Horn,kimberly36,Safe field lay response argue test someone region blue.,2412,1175,94,0
2024-03-23,ICICI Bank,Bobby Gibson,vsimmons,Long difficult TV tax performance run public write seem thought scientist recognize set technology executive could.,4781,493,361,0
2024-12-13,Bharti Airtel,Douglas Hudson,xgray,Thank reflect friend three meet garden power spend morning sit.,2715,770,694,0
2025-03-17,Reliance,Ryan Valdez,ybryant,Yard style later ready ready necessary avoid activity enjoy son government rest out story recognize.,2307,326,987,0
2025-03-04,HDFC Bank,Ryan Miller,ihardy,Financial involve central smile both should everybody join realize.,2234,1481,412,0
2023-10-08,Reliance,Alisha Lopez,hsmith,Responsibility machine direction color general good these his all specific region girl lose evidence number increase.,3793,1743,293,0
2024-06-25,ICICI Bank,Lauren Johnson,carl35,Effort cold their purpose experience month effect lawyer board.,4137,1202,990,0
2024-02-26,Reliance,Joshua Morse,watersgloria,Common call paper wife late over authority ever research training almost including seat mission do.,2680,1477,568,1
2024-07-19,Reliance,Jordan Zuniga,audreymoore,Suggest serious activity discussion eight school bar draw expect include think middle.,550,444,11,0
2024-04-07,HDFC Bank,Seth Palmer,rebecca65,Story front tax behind mind set too ask size.,3914,1885,706,1
2025-08-24,Bharti Airtel,Matthew Jackson,johnobrien,Bar level apply glass site agree carry why board remain.,3772,283,3,0
2025-05-20,Adani Ports,David Reed,patrickpamela,The claim successful visit news voice impact shoulder.,333,182,955,0
2024-03-01,HDFC Bank,Clinton Juarez,peter29,Bring outside magazine hot own strategy again wide.,4984,923,18,0
2024-09-23,Tata Motors,Joseph Williams,ashelton,Join answer dog alone space beat dream reveal month.,985,169,116,0
2025-06-06,Bharti Airtel,Russell Boyd,watsonpeggy,Seat name memory both instead people poor since gas citizen pick what city our.,3416,1018,22,0
2024-08-02,Reliance,Mario Norris,ericburton,Energy age approach station suddenly true news enjoy have change beyond.,908,713,975,1
2025-08-14,Wipro,Tyler Hess,ejordan,Send be behavior its address foot though ball store challenge.,1752,1149,945,1
2023-12-24,Bharti Airtel,Steven Price,hfaulkner,Seat report write apply east heart night.,4157,1054,124,0
2024-04-04,Wipro,Larry Acosta,hendersonkristin,Paper difficult east fly society beat alone make institution bag what purpose such race page.,2937,1493,139,0
2024-08-31,Reliance,Julie Jackson,gramirez,Sure prepare quite above outside almost call science American some.,4022,1948,518,0
2024-04-20,ICICI Bank,Heather Rangel,josesmith,Special item process administration friend from free soldier mouth dinner agreement tonight.,4425,1515,530,0
2025-08-28,Reliance,Christopher Mcgrath,trevinochad,Simply bar record amount store stand there.,470,427,597,0
2024-03-20,Infosys,Tammie Brown,dedwards,Space officer old fine affect nearly great audience.,36,666,930,0
2024-07-19,Adani Ports,James Bishop,annediaz,Deal probably authority wife like herself against cover focus north age hope more part you.,4000,955,634,0
2023-09-25,Tata Motors,Amanda Davis,jonathan54,Painting quickly difference difficult inside apply while understand hand ok cold worry.,2264,1652,686,0
2025-02-13,Reliance,Ralph Brown,zbeck,Become although his blue do drop low machine cell yourself recognize research.,4693,914,271,0
2024-05-06,ICICI Bank,Mark Berg DDS,conniewilson,Either accept through scientist student administration trial role establish Congress beautiful concern drive.,3820,497,600,0
2025-01-14,Wipro,Brittany King,ebenitez,Relate own heart cost among become another.,4037,1199,750,1
2024-10-21,Bharti Airtel,Dillon Mathis,dianesimmons,Son size level then two professor also coach raise.,1553,1051,204,0
2025-08-01,Wipro,Christina Jackson DDS,jcox,Why baby must career action their doctor half be field our audience mind.,2193,865,848,1
2024-07-29,HDFC Bank,Ashley Stevens,jerome40,Less need often increase ball former low rate after discover available sea throw.,3043,1325,826,0
2024-11-27,HDFC Bank,Johnny Mann,jasonwilliams,Message girl traditional cost ready have individual crime true.,3347,608,338,0
2023-10-05,ICICI Bank,Mary Fisher,cookbeth,Baby marriage wish hold and evening now weight note near perform.,524,779,133,0
2024-06-13,Tata Motors,Crystal Lee,april96,Collection too table out nor according step.,1909,497,587,1
2024-09-15,HDFC Bank,Robert Powell,ivincent,Certain could find build car yet early what bill picture thank loss lawyer night onto.,4369,1407,764,0
2025-07-08,Reliance,Jose Walter,lori37,Through from far fall get important southern hold thank speak us performance.,70,519,673,0
2023-11-21,Infosys,Elizabeth Shaw,dwilliams,Argue without listen certainly order provide research its ten full forward mean girl.,3608,1475,430,0
2025-02-04,ICICI Bank,Joshua Moore,jamesfoster,Soon realize listen seven teacher tough next left bed.,3005,560,205,0
2025-08-02,Adani Ports,Christopher Woods,michael89,Brother also yet billion real way develop wide hotel force interesting white return try.,3112,1325,749,0
2024-12-27,Tata Motors,Kathryn Cunningham,brandi16,Recognize onto table Mrs east reflect my feeling seek generation create.,3064,958,2,0
2024-05-22,HDFC Bank,Kylie Flores,woodardscott,Whom animal long garden city thought simply mouth.,1468,666,367,0
2024-11-11,Tata Motors,Mr. Robert Mitchell DDS,nelsonmelissa,Heart thought ago remember catch yes most without practice scene admit instead.,2505,1026,49,0
2024-08-25,Adani Ports,Amber Stein,michelleyoung,Election require course when challenge look analysis my treat necessary.,4240,676,270,0
2023-09-21,Reliance,Kelly Sullivan,lrodriguez,Central drop green develop physical evening pass American less.,2593,1092,117,0
2024-07-16,Adani Ports,Chelsea Austin,norrisjessica,Within others quickly continue small attorney poor give better more boy especially man bed.,2425,818,805,0
2023-09-18,Tata Motors,Rachel Romero,dylanharris,Base skill north sense relate factor him later red.,1344,841,535,0
2025-07-16,Infosys,Emily Shaw,carsongary,Market compare almost meet ability computer morning line spring out.,4869,126,864,0
2023-11-01,HDFC Bank,Miranda Garcia,howardchristina,Strong season physical place PM suggest find evidence lot poor rather speak past degree.,3276,593,649,0
2023-10-01,ICICI Bank,Christopher Tyler,eric61,Hotel wonder create Mrs for door particular them performance sense amount.,4563,1889,81,0
2024-03-06,Adani Ports,Toni Kerr,haleyharrison,Box must high central how prevent find attack responsibility group way now nature continue staff art.,1800,1010,496,0
2025-07-04,Wipro,Jacqueline Wilson MD,knoxmichelle,Deal music anyone nice positive out without summer.,1796,1450,537,0
2025-02-07,Infosys,Rhonda Rios,marissa73,Table talk admit him million artist determine ask end and affect later same have.,2971,285,494,0
2024-07-12,Infosys,Larry Cook,lisawilson,Anything clearly determine determine sell training doctor.,1982,1693,864,0
2024-04-19,Reliance,Catherine Moore,johnsonjeffrey,Step behind soldier center key similar writer money region cold bed west wait public light water.,203,1323,952,0
2024-10-12,Tata Motors,Henry Strong,theresa09,A other radio apply without others go might person trouble within try responsibility.,2966,777,816,0
2025-02-03,Reliance,Tom Parker,lanedouglas,Specific effort guess significant particularly meeting agree card argue buy young great sister program.,175,1075,54,0
2024-08-18,Bharti Airtel,Michelle Thomas,nicolewilliams,Focus treatment professional also natural every source through car game friend eat seven need rock.,3778,1327,237,0
2025-08-24,Adani Ports,Scott Wright,timothyramirez,Start read note company sit rest space professor director body follow.,614,1863,296,0
2023-10-16,Reliance,Catherine Smith,elliottandres,Practice indicate social house every thing bed occur war still happen page now leave natural animal.,251,1894,29,0
2023-09-28,HDFC Bank,Mary Miller,garrettsilva,Rest store science stop significant vote view spring peace remain themselves physical lead also hit food.,4074,1655,941,0
2023-09-30,Reliance,John Williamson,henry97,Last tough assume it position common decide community organization mind business move evening state trade.,4135,1516,896,0
2025-07-11,ICICI Bank,Kimberly Wagner,morgan89,Shoulder need quality kid card college management think my today history threat financial adult positive staff.,1835,1275,33,0
2024-05-26,Wipro,Russell Figueroa,royrhonda,Point successful send ok hot small build movement collection.,2541,1288,378,0
2025-06-06,Wipro,Taylor Johnson,linda53,Poor could popular employee dark table anyone life get sense room look make relate.,4696,332,23,1
2024-07-13,Bharti Airtel,Daniel Jones,smithcaitlin,Without five certain anyone safe speak phone get.,311,1728,766,0
2024-04-12,Adani Ports,Nathaniel Meadows,lawrenceochoa,Bad commercial even however kid herself major its step.,3208,1371,328,0
2025-06-21,Reliance,Samuel Matthews,marcbrown,Mrs him husband kind challenge bring most dream west article here.,1277,134,990,0
2024-02-07,Reliance,Juan Hess,ramosjordan,Walk task writer street adult step focus join.,4011,1618,14,0
2025-06-06,Bharti Airtel,Stephanie Walsh,sanchezpatricia,Increase pass seat economic rate second teach line nature standard writer nor particular player.,3153,547,340,0
2025-06-13,Reliance,Jeremy Warren,sierrashannon,Throw possible seem along newspaper major big less this.,764,720,103,1
2024-02-01,HDFC Bank,Taylor Rose,jamesjames,So day or value daughter instead enter employee popular thing father smile around watch summer.,2869,141,414,0
2024-12-30,ICICI Bank,Mallory Cooper,hdavis,Others clear range light still fly field mouth ok individual.,3517,384,571,0
2025-06-17,ICICI Bank,Christine Peters,rbrown,Fine soon bill early full rather receive.,1726,1256,928,0
2024-12-26,ICICI Bank,Jessica Johns,jhoover,Physical place central big system try already industry its ever official reality.,1930,856,580,0
2024-12-26,Reliance,John Green,valenciachristopher,Word couple fight very identify act series right direction can mother approach population plant cause ready.,969,89,62,0
2025-04-12,Bharti Airtel,Rachel Stephens,cobbnicholas,Huge pay natural person manager respond manager.,3395,1251,295,0
2024-10-28,Tata Motors,Dr. Nancy Martinez,bretthendricks,Though cup life indicate summer computer rock send school firm white bring even society.,4661,348,494,0
2024-10-30,Wipro,Leslie Rodriguez,kprice,Enjoy story become eat while game hard.,3372,871,176,0
2024-03-14,Wipro,Brian Dean,james16,These you phone check foot travel assume likely white quickly even leg thus become sister.,2519,1285,620,0
2024-07-15,Infosys,Allison Quinn,fromero,Type president price spend figure return when.,2100,619,815,0
2024-07-01,Bharti Airtel,Dr. Lisa Potter DDS,davidcortez,High money challenge a relate happen perform.,305,461,602,0
2024-02-25,Reliance,Alan Rice,harmstrong,Move treat during boy life culture capital instead last include smile enter show.,1475,785,895,0
2023-12-09,HDFC Bank,Crystal Odonnell,brandonbird,Wear share issue use material step current on product bag beat service guess cut from begin.,4161,1644,541,0
2024-04-04,Adani Ports,Bridget Smith,rriley,Alone officer respond similar claim three fill growth example prepare.,3404,1986,296,0
2025-04-05,HDFC Bank,Gabriel Martinez,sking,World read too professional hot today card require trip song collection.,2059,1344,589,0
2024-06-23,HDFC Bank,Erin Porter,cynthia75,School side admit main reduce cut model state less star if station.,3122,662,61,0
2024-04-30,Adani Ports,Craig Munoz,owalters,Tend create property good field employee happen enough debate.,1815,1134,661,0
2024-12-20,HDFC Bank,Jeffery Graham,dmcdaniel,Result race law cut easy oil red interesting realize.,247,94,512,1
2024-01-01,Wipro,Catherine Everett,andrewhuynh,Skin any home child development chance teach resource relationship always no result.,3043,9,800,0
2025-01-01,HDFC Bank,Melissa Scott,brittany83,Community trouble protect build available them among plant there church.,3148,392,122,0
2025-01-03,ICICI Bank,Tracey Tate,thomas41,These man early bill perhaps prepare then include she.,3525,1915,879,0
2024-08-26,Tata Motors,Blake Wolfe,jtaylor,Idea north push official manager surface skill affect grow offer certainly customer receive scene over yeah.,4227,368,283,0
2024-04-24,HDFC Bank,Glenn Rodriguez,george64,Position under consider when name past born son head marriage state read.,99,722,167,0
2024-01-04,Reliance,Courtney Ashley,angelashaffer,Pick long its act camera information eye nature.,4543,576,894,0
2025-04-28,Reliance,Matthew Sanchez,careywesley,Ask total worry goal by law kind anyone technology almost place health health set yet ball.,3069,518,584,0
2024-05-21,ICICI Bank,Eric King,baustin,On take voice grow subject painting TV method.,1179,1751,159,0
2025-05-05,Adani Ports,Joshua Anderson,isullivan,Far over positive keep fund break public night animal huge another budget most.,827,171,155,0
2025-03-07,Adani Ports,Chad Kirk,wrightzachary,Value gun serious crime despite child name player action piece school physical.,2191,340,459,0
2024-04-27,Tata Motors,Sharon Sloan,agrimes,About indeed form moment television medical enter tell.,315,1314,978,0
2023-09-13,ICICI Bank,Melinda Pope,rioscole,Network blue ability parent stop Mr medical catch level star.,1601,625,338,1
2024-04-11,Wipro,Brittany Hill,walkermichael,But than my have decade degree use large.,1857,181,927,1
2025-06-03,Wipro,Alicia Murray,madison89,Specific second purpose image decision form international join sure heavy above.,4299,780,970,0
2024-04-28,Adani Ports,Johnny Johnson,cannondonna,Sign wall together participant wind PM wear thus conference make eight not evidence base cell.,1828,453,852,0
2024-12-11,Wipro,Michael Banks,reginapayne,Fill themselves organization heavy open try likely position agreement process surface difficult.,4780,1813,603,0
2023-12-30,Bharti Airtel,Christopher Roach,oclark,Table fine building person trade allow choose knowledge good activity.,2672,1526,974,0
2023-12-22,Adani Ports,Ryan Garner,zjones,Middle plant begin western around charge three for agree education coach health.,4228,908,753,0
2025-05-29,ICICI Bank,Melissa Hicks,vspence,Long democratic top full career change bit middle unit.,3080,1633,205,0
2023-12-29,Wipro,Megan Fitzgerald,sarahbeltran,Feel information amount candidate area student different increase sea grow add learn.,1872,1232,721,0
2024-09-22,ICICI Bank,Annette Estrada,scott46,Forward leave somebody matter most card commercial wear card low enter lead maybe.,1670,1771,1000,0
2024-08-29,Bharti Airtel,James Hill,uharris,Item notice tax reality eight cold blue itself.,349,1443,211,0
2025-02-23,ICICI Bank,Laura Chandler MD,brandybowman,Administration these brother story draw wide develop American able.,3722,692,13,0
2024-07-18,Wipro,David Sanchez,kellybrown,Little field claim truth same stock most sign force audience carry simply child.,4858,1354,573,0
2025-05-30,Adani Ports,Michaela Mercado,brownsandra,Though politics edge how machine would officer exist since real morning.,1429,591,112,0
2025-04-13,Tata Motors,Hailey Martin,dalegrant,Site radio news style employee real serve mouth hear language cover white senior life fish.,1494,1146,763,0
2025-07-04,HDFC Bank,Angela Sexton,clewis,Kid newspaper although seek where high safe.,4444,598,724,0
2023-11-16,Reliance,John Hobbs,cheryl38,Color and kid tell bring exactly member president.,2688,465,308,0
2024-11-23,Adani Ports,Douglas Oneill,fosterrodney,Push but the recognize opportunity represent system tonight oil.,1549,1296,971,0
2024-11-18,Tata Motors,Andrew Alvarez,wagnerjerry,Local cost media firm weight say when why.,2269,904,2,0
2024-12-18,Bharti Airtel,Jessica Anderson,vkeller,Role seem fire section general throughout room site gun management direction billion pretty full lay fund.,4952,737,647,1
2025-05-23,ICICI Bank,Gregory Hayes,sharonjones,Movement compare none office affect yes hundred wait success.,1291,477,707,0
2025-03-22,Infosys,Ivan Nicholson,davissteven,Language whatever two citizen task PM heavy article decision expect all.,3793,1041,467,0
2024-07-02,ICICI Bank,Crystal Morris,vmccarty,Another would but picture way evening education.,3387,670,47,0
2024-01-12,Bharti Airtel,David Stone,smallandrea,Want dream artist detail new personal thank.,2468,84,360,0
2025-01-31,ICICI Bank,Andre Pruitt,richardray,High body gas look challenge after father piece line wish.,3444,886,594,0
2024-04-11,ICICI Bank,John Dunn,mckenziecory,Possible learn official decide Mrs so action he action recognize rule.,856,1219,724,0
2025-08-18,ICICI Bank,Belinda Garner,rebecca03,Save million can red ask market whose use through color.,556,1436,676,0
2023-11-02,Bharti Airtel,Christian Meyers,spencercarter,Fear nature sign son have put me kind building month.,4251,773,62,0
2024-04-17,Reliance,William Mejia,jennifer16,Hold your country memory memory rich staff.,454,448,784,0
2024-09-07,Infosys,Deborah Anthony,martin78,Performance next along region rather research enjoy agency cell first receive us sister push according.,275,1781,897,0
2025-05-21,Tata Motors,Keith Clark,thomas46,Interview skill analysis area threat begin lawyer century right indicate husband goal ahead from.,2190,1832,405,0
2024-06-15,Reliance,Tony Fisher,andrea83,History bad check plan run trip current.,4878,1579,674,0
2025-03-18,Reliance,Patricia Lopez,christinawalsh,Specific item short happy church memory imagine security above finally push about always.,408,786,942,1
2025-04-06,Tata Motors,Christopher Johnston,ushaffer,Any benefit wonder military mean late them himself garden unit civil state science.,1587,127,464,0
2024-06-18,Wipro,Michael Carey,nelsonchristopher,Letter stop spend firm large time view nature get candidate film or radio form.,4154,908,357,0
2025-01-04,HDFC Bank,Teresa Thompson,gcallahan,Management run political style dog between movie.,1584,1161,936,0
2025-06-23,Wipro,Tina Perez,kylesnyder,Very firm break power scene and find certain.,61,1501,855,0
2024-04-06,Adani Ports,Beverly Jennings,ydominguez,Start charge inside wish board sure east century customer billion set life few clearly out.,2442,1461,893,1
2024-10-30,HDFC Bank,Anthony Holloway,garciadonna,Time partner government positive effect reflect free thought may.,2708,398,640,0
2023-11-18,ICICI Bank,Jeremy Roberts,tina23,Individual PM write always him specific mention everyone morning wait American young community.,3891,226,625,0
2024-01-24,Reliance,Kristy Hall,sampsonjacqueline,Phone director for could back hospital although coach western require.,1089,1936,8,0
2023-11-21,HDFC Bank,Jessica Boone,velezangelica,Player indeed step strategy build Mr wait lead movement night yourself land role character leave sister.,1353,947,140,0
2024-12-22,Reliance,James Kelly,lharrison,Knowledge tell show staff reason source scientist history second others society grow present professional machine.,4501,1318,609,0
2025-03-09,Reliance,Michelle Flynn,jacob81,Ball serve long question increase remain watch present throw.,3849,413,803,0
2024-11-10,Tata Motors,Jennifer Wilson,qmartinez,One letter big fight camera itself military house contain citizen again knowledge consider director.,815,559,107,0
2025-08-04,Reliance,Brianna Armstrong,jessicabrown,Save pressure apply cell wrong much one she fact.,2004,481,38,1
2023-12-23,Infosys,Colton Evans,johnmunoz,Simple serve natural analysis friend ball view none drug cut provide.,4301,1749,618,0
2024-03-15,Adani Ports,Laura Rose,jonathanwarner,Box seven local garden tree sell which determine nearly plan provide rule stand staff.,2059,1875,911,0
2024-12-27,Infosys,Beth Jordan,kjones,Black half season this new guess seek some though base suddenly bank itself.,4957,130,764,0
2024-07-28,ICICI Bank,Kayla Sanchez,uholmes,Trial music significant live actually poor green your pattern benefit.,3078,727,130,0
2025-03-17,Wipro,Brittany Jackson,caitlyneverett,Road capital none name meet method early story.,4059,1114,45,0
2024-09-06,Reliance,Michael Johnson,randerson,Source why key each most ready ask model idea bank owner know apply garden.,2053,336,280,1
2024-12-15,Adani Ports,Melissa Brown,michael58,Information late base history Mr behavior large sort hot you which black.,1588,1909,346,0
2024-03-11,Adani Ports,Jose Delgado,jennifer68,School worry suggest only thus image court finish energy.,2555,307,52,0
2024-09-10,ICICI Bank,Sarah Armstrong,kimberlymccarthy,Tv Republican necessary carry commercial card newspaper wide remain participant through none page answer world.,132,1074,145,0
2025-03-10,ICICI Bank,Vincent Ingram,valentinedakota,Campaign address one live indicate attention certain especially class shake executive century talk young win.,2396,126,294,0
2025-03-01,Tata Motors,Dawn Herrera,angela43,Certainly art always stand board speak grow inside evening court open.,1707,1051,141,0
2023-10-13,Wipro,Rebecca Underwood,abenjamin,Them could traditional collection stop mind both draw approach seven number network information.,3861,359,444,0
2024-01-07,Adani Ports,David Jimenez,robertgentry,Charge feel start real prepare value not determine everybody night two.,946,463,354,0
2024-06-26,Reliance,Cody Little,mirandawolfe,Allow organization my spend eat benefit maybe.,1870,726,510,0
2024-09-29,Infosys,Dustin Woodward,sanchezpaige,Station condition personal year large knowledge be throughout consider.,1708,1410,616,0
2023-10-23,Bharti Airtel,Phillip Matthews,owenchad,Main behavior method listen player decision once tell wall.,3532,1399,152,1
2024-08-25,Adani Ports,Daniel Price,leblanccassandra,Building down economic toward religious player a market produce.,4390,691,624,0
2025-08-28,Bharti Airtel,Jeremy Harmon,garzaadam,Become garden machine difficult contain worker direction kid let up degree.,3631,1328,545,0
2024-10-30,ICICI Bank,Amy Pugh,clopez,Head ahead else will science one without generation future significant establish direction best.,4497,1852,707,0
2023-09-25,Tata Motors,Vanessa Downs,taylorjanice,True firm new act thing although care yes lose protect picture although staff beyond.,4037,521,406,0
2025-08-26,ICICI Bank,Robert Crawford,christophercarson,Gas relate situation important use unit almost thank.,3071,355,703,0
