date,company,advisor_name,username,post_text,likes,retweets,comments,label
2024-10-30,ICICI Bank,Justin Edwards,kristinahenderson,Relate sea return debate wrong join citizen yourself dark however senior week money.,698,1117,654,0
2024-08-09,Adani Ports,Melissa Howard,kimrosario,Edge point put interview popular consider rather risk without.,3349,1708,80,0
2025-04-30,ICICI Bank,Michael Freeman,garciabrooke,Stock prepare kitchen rise then Republican base simple in seven.,2839,1574,178,0
2024-12-13,Reliance,Peter Brown,travisbenton,Possible cell service customer under last still affect improve keep seven.,4731,1425,589,0
2024-07-05,Reliance,Mandy Gonzalez,rebecca25,Nor author important lot half oil skin three thousand response there stuff seek while.,2802,1575,366,0
2024-08-30,Wipro,Patricia Adams,ghale,Positive project along provide run carry option play inside paper describe which.,377,1616,54,0
2024-01-22,HDFC Bank,Michelle Hogan,rebecca18,Good fall above stop medical how agreement goal late.,4478,1988,307,0
2024-07-08,Tata Motors,Norma Bailey,gomezshannon,Same woman little speak young among positive sport energy yes relationship apply must.,4166,1063,339,0
2024-12-08,Adani Ports,Gregory Shea,barnesrachel,Phone business name discuss receive turn interest commercial.,3180,1952,497,0
2024-12-27,Tata Motors,Mark Hansen,alexandernicole,Place trouble personal political PM everyone run someone those but.,2156,1869,607,1
2024-08-08,HDFC Bank,Robert Mueller,robertrivera,Thank common seat scientist head piece woman safe western year anyone amount speech outside put dark.,2581,1866,45,1
2024-01-16,Adani Ports,Karen Wall,lisayoung,Culture interesting instead anything discussion cultural she like indicate.,810,1846,477,0
2024-08-05,Wipro,Jennifer Freeman,dunnnathan,Join seat month citizen save start break soon.,21,299,700,0
2024-09-01,Adani Ports,Aaron Smith,yhayes,How recent wish will activity explain development remain carry television.,2860,448,807,0
2025-04-23,Tata Motors,Daniel Perkins,william42,Age man learn those claim sort skin court front list blue drop responsibility.,4434,336,591,0
2024-12-02,Infosys,Jeffrey Clark DDS,ian86,Smile cell thank third chair detail machine challenge skin husband single imagine lay group civil.,4798,1660,201,0
2023-09-21,Reliance,Logan Webster MD,christopheraguirre,Determine board produce pretty night civil weight successful.,2200,1849,751,0
2024-03-21,Bharti Airtel,Jennifer Jones,brettmorris,Its deal station room education wall play stage fish employee brother across middle.,3711,443,725,0
2023-10-28,Wipro,Melissa Gibson,alyssaphillips,Road involve second prove must truth example field camera draw under center enter themselves choice employee.,4497,310,709,0
2025-04-19,Reliance,Corey Johnson,heathdavid,Mention huge arrive government else off street board success put study perform record sound.,3255,1430,538,0
2024-07-11,Tata Motors,Matthew Thompson,daniel82,With might collection tax appear result summer happen accept want.,3340,1330,491,0
2025-09-08,Infosys,Linda Dodson,balvarado,Sport man view sure ready way talk tell door.,2328,1971,559,0
2024-02-17,Infosys,Brian Weber,santhony,West Democrat short industry wrong player particular city bed class popular ability.,2506,1193,457,0
2024-08-15,Infosys,Joseph Rojas,stoneshawn,Clear level account dream seem either free ball assume indicate wall through evening end everybody main.,824,464,516,0
2025-04-10,Wipro,Tonya Hughes,williamfrazier,Short first lose for challenge shake little throughout idea lawyer loss report.,2419,1897,407,0
2024-04-05,Infosys,Joshua Maddox,cfields,Nearly different sell glass put nearly ahead medical.,3656,883,188,0
2024-09-26,Adani Ports,Charles Jones,twilliams,Lay return memory picture who glass size seven short rich over sense old.,4539,1219,378,0
2025-06-27,Adani Ports,Anthony Flynn,michael20,Month support kitchen keep office ever open of.,3032,1322,268,0
2024-03-08,Adani Ports,Rebecca Swanson,wruiz,Training far kitchen energy by sign road father major this.,4398,1270,687,0
2024-01-09,Reliance,Ryan Burke,trodriguez,Pay low spend wear reduce century country partner process guess action court price blood.,2113,916,549,0
2024-10-01,Tata Motors,Joshua Kelley,johnmcbride,Move member since action rest general out few American.,1836,1411,777,1
2024-06-27,ICICI Bank,Kathleen Allen,coxdenise,Put never them it although record movement energy data strategy determine keep be program especially sense.,1662,802,407,0
2024-04-13,Wipro,Melissa Reynolds MD,smithdavid,Street cost why hand even past nice surface career.,2521,680,57,0
2024-12-19,Bharti Airtel,Regina Brown,nshaw,Look section guy heavy task your thing nature have high.,1960,1629,612,0
2024-08-31,Infosys,Nicole Fleming,stephanie85,West street window mouth experience performance party stuff far north already learn capital magazine.,4636,1555,651,1
2025-06-07,Wipro,Jessica Williamson,ypowers,Read top fall least success interesting arm national another.,183,1915,190,0
2025-03-07,Bharti Airtel,Morgan Sullivan,wilsoneduardo,Evening nature not someone break ground whatever imagine civil game while agree life kind.,1121,1797,481,1
2023-10-22,Infosys,Scott Williams,hadams,Particularly west sign best group face customer offer current huge.,192,1032,885,1
2024-05-15,Reliance,Charles Mathis,tylerbrown,Mind size paper important month into someone lawyer save window me design affect law even.,2051,611,769,0
2024-12-06,Bharti Airtel,Michael Lopez,christopher00,Must word check writer force various me collection scene number father.,4050,1981,336,0
2023-11-06,Tata Motors,Sharon Marshall,brandianderson,Science section down window whatever road stock adult word red.,159,1108,89,0
2024-05-30,ICICI Bank,Chelsey Cherry MD,salazardana,Model year likely mother east million particularly house experience public Congress.,2983,1795,618,0
2024-12-21,Adani Ports,Jennifer Garcia,crawfordheather,Fact employee floor decide find chair risk chair similar lawyer sometimes agent.,3230,1443,19,0
2024-11-05,Infosys,Benjamin Wiggins,guerrerobrittany,Fact would wrong artist her around model road.,869,394,590,0
2025-03-15,ICICI Bank,Joseph Ellis,hawkinstimothy,Significant sport produce within indeed race open catch especially impact leg seek.,2683,48,897,0
2025-01-18,Reliance,Lisa Robles,jamesfleming,Gun chair actually foreign care me difficult finish include voice.,3373,1979,817,0
2024-01-30,Adani Ports,Lacey Griffin,hollybennett,Analysis turn work player parent indicate grow by family.,2915,715,977,0
2023-11-14,Tata Motors,Ellen Flores,upowell,Plan treat effect material meeting every task project chair guy be rule knowledge.,4981,1499,646,0
2024-10-17,Bharti Airtel,Amy Turner,kristin41,Lay forward woman once enjoy important talk age.,193,1620,783,0
2025-03-09,Adani Ports,Lauren Ochoa,walterscorey,Discuss it anything science operation technology visit.,1703,101,500,0
2024-07-28,Infosys,Doris Harris,jennifer87,Energy list owner human city network ten pattern meeting method machine wish less process.,2165,923,667,0
2024-12-05,HDFC Bank,Susan Peterson,masonchristopher,Return box whom success offer degree security ground answer himself arrive serious.,4448,1007,223,0
2023-11-02,Bharti Airtel,Anthony Smith,nkaufman,Actually sing character become garden create matter play word pay small part.,1187,1414,289,0
2024-02-07,Tata Motors,Kelly Sanchez,danielrogers,Training Congress forget ready spring member authority.,201,588,418,0
2024-11-03,Wipro,Reginald Boone,davidharper,Data huge short reason skin game article despite image account born identify society sign simple.,4811,1929,392,0
2024-05-10,ICICI Bank,Lisa Griffin,fcrosby,Quality seat issue third rule else fear.,4485,565,295,1
2024-08-24,HDFC Bank,Betty Roberts,emily22,Worry significant quality work town without environmental success benefit hand indicate fine from image.,4185,382,157,0
2024-05-21,Bharti Airtel,Cory Garner,zdavis,Occur happen send great hard various clear tough north candidate glass home wife radio front.,12,400,605,0
2024-12-06,Wipro,Erin Smith,ferrellkatherine,College out modern first have shoulder front.,805,578,953,0
2024-06-27,Reliance,Gordon Roberts,jackson33,Miss food make rise least interesting test peace term mean likely necessary third want herself.,772,461,832,0
2024-04-08,Wipro,Douglas Kane,matthew97,Event your success anything deep pressure seem decide particularly two tree realize professional.,2735,1214,796,0
2025-07-05,ICICI Bank,Paul Barrera,dbrown,Important baby lose something example should later actually.,2319,689,290,0
2024-08-16,Adani Ports,Jonathan Burke,nathanielcoffey,Through check product glass recently who theory it TV season place family claim first.,1728,1976,558,0
2025-03-17,Wipro,Jennifer Woodard,james67,Risk identify by level month six include remember interview future view along.,2141,1098,215,0
2024-11-11,Wipro,Kimberly Adams,elizabethmurphy,To computer choose goal defense bit service fall send rich successful hear first camera sign number.,782,890,282,0
2024-11-17,Wipro,Ryan White,anthony51,Whom pull according set across clear cost article catch check any loss today close police.,875,913,68,0
2025-07-18,ICICI Bank,Megan Miller,emora,Stand no allow add morning theory than stuff.,1553,1358,814,0
2023-10-17,Wipro,Tami Levine,hkim,Wonder language but hard military hit parent evening this chance girl.,1611,1784,633,0
2025-08-29,Adani Ports,Austin Reynolds,kwhite,Lawyer approach hear skin think person financial resource identify hundred trip.,2580,1155,506,0
2024-03-22,ICICI Bank,Michele Kelly,patrickbarber,Into choice choose magazine student example project during word prepare worker region focus next school great.,4262,113,921,0
2024-07-22,Infosys,Darlene Robertson,carriegarrison,About magazine teach picture send little song physical figure nothing short go.,2953,1935,665,1
2025-03-13,Tata Motors,Christopher Warner,orivera,Story scene difficult forward everybody radio full.,4345,1656,284,0
2025-01-06,Wipro,Joshua Lopez,mcross,While wrong hour total get test design pick father do grow responsibility know reason.,1150,206,531,0
2024-10-23,Infosys,Sean Callahan,shannon98,Quality direction building production weight billion everyone thing find mission news fight major onto to service.,572,398,936,0
2025-08-12,ICICI Bank,Ann Olsen,martinezstephen,Office thank able cell five course always business church also.,3617,1453,484,0
2025-09-10,Adani Ports,Alejandra Hinton,williamsjeffrey,Wish speech table sound environmental once first.,4823,778,351,0
2023-10-04,Wipro,Amanda Espinoza,woodmatthew,Protect power writer way able same rock option democratic daughter performance record career drop customer chair.,2017,261,776,0
2025-03-27,ICICI Bank,Alexandra Roberts,mullinsderek,Service learn begin effect explain pressure court son project matter.,3304,367,227,1
2024-07-02,HDFC Bank,Charles Campbell,tracy68,Congress stay often quality control space available measure include report result fight could left contain wear.,4118,495,555,0
2025-02-08,ICICI Bank,William Owens,swest,Knowledge both card star society hundred story school effort.,302,1704,975,0
2024-10-08,Wipro,John Choi,natalie36,Practice result population present rest and probably trouble where too road agreement best player.,5,493,83,1
2023-12-14,HDFC Bank,Patricia Williams,crodriguez,Some pick all imagine manage power would single party own ask though during candidate already.,3909,239,260,1
2025-08-31,Bharti Airtel,Bryan Abbott MD,moorealison,International church toward member company marriage least turn stage.,3521,1222,812,0
2023-09-22,Wipro,Michael Smith,cassandracampos,On perhaps civil way Mrs court open.,3190,795,708,0
2025-08-05,Infosys,David Cruz,matthewhughes,Establish newspaper so family onto since consumer future night police know word use western who deep.,1651,1299,947,0
2025-08-21,Adani Ports,Laura Smith,gloverronald,Federal true remain play yard suggest believe.,552,796,43,0
2023-12-20,Bharti Airtel,Brent Lloyd,lopezjoshua,Story development until black what end treat college which security receive improve.,4109,1333,752,0
2025-02-06,Infosys,Frederick Sexton,ujackson,About doctor deal decide compare field agreement enter.,3658,1410,290,0
2024-04-05,Tata Motors,Catherine Solomon,ocox,Beautiful must military the reach far how against talk floor build all resource.,229,1611,262,0
2023-10-13,Wipro,Renee Moore,huffedward,This idea fill long effort provide other west age actually.,1143,1017,619,0
2025-05-23,HDFC Bank,Melissa Reyes,eric47,Majority wait themselves new personal present call nearly fact research hot social customer end part woman.,1666,125,482,0
2025-03-08,Infosys,Julie Harris,elizabethharris,Significant outside eight offer resource store yeah simply.,1485,1030,692,1
2024-08-07,Bharti Airtel,Haley Hardy,john07,Claim focus enough test painting million measure society foreign per goal agree run eight marriage since.,3065,362,346,0
2025-03-24,Reliance,Kimberly Day,cookelizabeth,Marriage home upon keep contain toward crime third improve.,2826,501,922,0
2024-10-31,ICICI Bank,Amanda Diaz,jessicapeterson,Third different billion side main investment third life black main gas industry last teacher support two.,2779,1407,896,0
2023-12-05,Adani Ports,Andrew Bates,miguel13,Job child country current character as girl word.,1091,1395,767,0
2023-10-03,ICICI Bank,Christopher Hernandez,jamestodd,Across none because operation training population forward nice buy character course suffer then school minute.,4172,795,933,0
2025-06-23,Tata Motors,Elizabeth Cruz,scott68,Face occur case heavy material commercial necessary which beat than nice community.,1943,1202,726,0
2025-02-13,Reliance,Alex Mccullough,joannagarcia,Rest foreign toward store risk visit maintain industry allow either various city music everything I identify.,148,467,941,0
2024-03-03,Wipro,Meghan Gonzalez,kbarron,Arrive understand your second pass common past fund.,2384,1142,836,0
2024-08-22,Wipro,Aaron Rosales,arnoldraymond,Civil save personal budget operation must charge end.,16,1476,504,0
2025-06-08,HDFC Bank,Nicole Jones,gregoryramos,Anyone cold stock partner ground successful happen class far feel ability.,1956,1580,994,0
2024-03-17,Bharti Airtel,Julia Walker,michael41,Statement sea determine into worker management someone police ever particularly agency save word.,3753,1994,594,0
2024-01-20,Adani Ports,Eric Sampson,brownjennifer,Glass traditional traditional fish fill party its anyone total believe.,3940,829,87,0
2023-10-08,HDFC Bank,Dr. Kristin Haley,tporter,Door morning our probably music guess who before whole cut.,3556,1401,778,0
2024-11-23,Infosys,Nicholas Miles,larry21,Cultural human mention campaign sit trial ready increase policy perhaps himself prepare the central official.,2036,739,873,1
2024-11-21,Wipro,Isaac Harmon,timothywalker,Billion color marriage three imagine main fire film city piece seek new yes people billion foot.,2788,638,357,1
2025-09-04,Tata Motors,Douglas Andrade,brandon22,Dark recent receive once last north newspaper source man.,3358,58,695,0
2024-07-20,HDFC Bank,Paul Carter,trandavid,Serve kitchen type manager bank suggest soldier participant product perhaps heavy.,3991,273,694,0
2025-01-08,Bharti Airtel,Cassandra Thomas,ylopez,Season paper goal space run employee action financial behavior significant bill list clear.,2549,794,360,0
2024-01-26,Bharti Airtel,Lisa Pham,hodgesrobert,Time yes minute think rise at particularly.,1753,1211,881,0
2024-09-11,Adani Ports,Melanie Elliott,william73,Beautiful friend sense here trial summer despite generation give various structure realize discussion.,3378,1348,59,0
2025-01-29,HDFC Bank,Derek Morris,aalexander,Loss fire perhaps middle buy might those than.,2288,368,528,0
2025-03-13,Wipro,Brian Davis,matthew53,Message idea worry party off truth adult process which I increase parent financial.,3666,1014,368,0
2023-12-22,Tata Motors,Michael Torres,guzmanmargaret,According former during every require any resource move power party detail rise myself son.,2248,601,949,0
2023-11-01,Infosys,Daniel Franklin,marthahunt,Light piece government better use country model student road practice talk strong probably worker focus half.,3975,1674,588,0
2024-05-06,Adani Ports,James Mercer,mark53,Everyone single environmental almost night produce analysis especially.,3412,1650,42,0
2024-08-29,ICICI Bank,Ashley Zimmerman,ugreene,Remember seat specific writer enter officer PM realize discuss hospital seat theory animal.,2569,859,725,0
2024-07-19,Infosys,James Holloway,hillscott,Success kid read month arm industry culture discover door imagine form before.,4299,1008,60,0
2024-08-27,Infosys,Joseph Trujillo,morriseric,Sport treatment leave project believe laugh main raise.,1375,508,275,1
2025-04-03,ICICI Bank,Michael Morgan,matthew09,Positive still skin natural west west field.,2324,1550,956,1
2025-01-13,Wipro,Joshua Cruz,buckjoshua,Skill control shoulder movement young enter test perhaps hair particularly.,3783,70,407,0
2025-03-22,Wipro,Ashley Owen,deaton,Well develop picture group next instead pull else among true side possible peace agree would down.,2170,1007,448,0
2023-12-06,Infosys,Tanya Hodges,davidchan,She huge very forward claim candidate defense nothing site difficult seat guy cold seven.,4315,1253,535,0
2023-10-09,Infosys,Wendy Martin,hritter,Strong guy place be risk story final table site not explain choose hair discussion teach out.,1246,1646,321,1
2025-05-31,Tata Motors,Sonia Walker,pjohnson,Get course movement include series big threat what be full next produce place bag.,4317,501,261,0
2025-07-22,Reliance,Mark Thomas,griffinjeffrey,Few live any ability project without good others short positive fly sing whole together successful.,4983,1895,508,1
2024-08-21,Infosys,Joseph Thomas,ejordan,Great another particular before if voice there let position require.,1275,690,654,0
2025-06-13,Reliance,Michael Turner,joseph59,Speech fight ground feel one check key industry deal interview sure performance deep appear those because.,3646,357,613,0
2024-07-25,Bharti Airtel,Daniel Boone,duanejones,Cultural instead one once owner key experience miss program.,3364,1251,979,0
2024-02-15,Tata Motors,Caroline Gonzales,jgray,Thank there road feel share throw personal individual also will white social.,2297,741,328,0
2025-08-21,Adani Ports,Devin Elliott,joshua75,General suggest visit century until day detail possible knowledge win investment information money bag key writer.,1845,121,910,0
2025-06-17,Infosys,Amy Farrell,stephaniesimmons,Color we wife care key wear outside house beyond example month amount.,3401,120,742,0
2024-08-19,HDFC Bank,Shawn Wu,erodriguez,Against collection oil risk some book budget first friend special he me school trial.,3771,1786,86,0
2024-04-07,ICICI Bank,Carol Cruz,mark07,Price no each would firm experience report lot drug value marriage fight most meet.,2806,1414,269,0
2024-01-31,Bharti Airtel,Danielle Williams,heatherrobinson,Author every military lose head them yourself century authority change agree form quality.,3009,1913,597,0
2024-04-09,Adani Ports,Andrea Davidson,jesushoward,Heavy central side learn whatever my perhaps court late spring soldier speak nice live.,4336,198,27,0
2023-09-23,HDFC Bank,Tony Lewis,philipsanchez,Give itself statement share bad suddenly executive light.,1839,374,920,0
2024-09-07,Adani Ports,Candice Pollard,josephallen,Point Republican question pattern good impact according difficult close determine life people increase.,2876,316,87,0
2024-03-16,HDFC Bank,John Andrews,griffinlinda,Analysis business successful class so task husband around throw red to middle result.,2535,758,842,1
2023-12-09,Reliance,Matthew Smith,alexanderdanielle,Industry phone federal give mother after return term quality street stop score color hour again.,737,1456,744,0
2024-01-31,Reliance,Craig Garcia,brandongonzalez,Reflect black tend plan by us size despite discover identify letter act per mention.,975,9,779,1
2025-01-21,ICICI Bank,Robert Mcdonald,uwatson,Goal everyone suddenly middle me up hospital college that growth marriage response drop bar finish.,1877,1199,129,1
2024-06-07,Tata Motors,Amber Wells,smartinez,Director relationship value hear economy pretty health where college Democrat realize tend perform he.,834,992,225,1
2023-09-15,Tata Motors,Maureen Miller,jessicapacheco,Street forward college police consider of cell situation.,171,850,698,0
2024-05-14,Reliance,Ryan Alvarez,zhorton,Organization strong would glass thought candidate manager however ahead help.,426,909,38,0
2024-02-08,Infosys,Jennifer Hodges,david03,Pressure public part wear beautiful such than.,4204,220,560,0
2025-08-12,ICICI Bank,Justin Pineda,tony57,Card probably set mother green back sort use within.,4531,25,208,0
2024-02-05,Wipro,Bradley Gillespie,icarter,Cultural bill hand author service save modern anything network anyone station threat what.,1859,461,403,1
2025-01-16,ICICI Bank,Mark Beck,saranichols,Enough leave rule attorney doctor employee phone.,1496,1377,579,0
2025-02-19,Wipro,Jason Reeves,richardpatterson,Can item as minute may large sure full save final look work glass heart ahead single.,394,1631,403,0
2024-07-14,ICICI Bank,Mariah Bell,john06,Factor difference buy write job board voice your people.,352,1912,538,1
2025-06-06,Bharti Airtel,Karen Le,fullerdarius,Government ahead court likely protect state its like whole scene computer challenge easy.,4283,1147,478,0
2024-09-27,Infosys,Colleen Crane,jordan19,Administration wear dream policy though show college seven act write throw see.,3854,774,124,0
2023-09-17,Tata Motors,Timothy Hall,adamsmichael,Attack letter call wear anyone city else beautiful meeting positive generation model from check.,2271,708,398,0
2025-07-22,Bharti Airtel,Katie Larsen,kathryn20,Peace five crime suddenly lot which system fund produce court player store speak maybe and put.,297,1940,39,0
2024-07-10,Infosys,Nathan Burns,ktorres,Oil rich thank TV become wide large adult heavy significant forward new example standard he.,1842,936,461,0
2025-04-26,Wipro,Jose Jordan,michellesanchez,Place college black spend part talk activity move change through world little thousand machine.,208,1255,999,1
2023-11-15,Reliance,Carl Martin,mariasantana,Up soldier so really deep but new maintain under election.,612,1775,293,0
2025-05-03,ICICI Bank,Caleb Murphy,ashley59,Shoulder natural word mean just possible store law agent easy head degree.,4838,140,846,0
2025-07-13,Wipro,Alvin Paul Jr.,marksdale,Late speech necessary area capital look far over report.,4150,1208,80,0
2023-11-02,Wipro,Katie Carter,hhughes,Plan national help well tough tend ago finish.,4490,826,885,0
2025-02-08,Infosys,Dawn Kent,vadams,Weight should imagine worker listen employee series note build international.,49,201,983,0
2025-02-06,Adani Ports,Amanda Hampton,allen20,Fact trial out agreement my medical spring benefit none movement traditional art discuss.,2871,522,448,0
2025-01-17,Adani Ports,Ashley Gibson,josephmiller,Or ok do center detail trial use list senior business manage professor bring later building.,1014,1809,899,0
2024-03-04,Reliance,Mikayla Castillo,colleen90,Season arrive enter watch international evening military risk election.,315,475,218,0
2023-11-29,ICICI Bank,Benjamin Carr,boydbarry,Tv answer according job develop every owner authority cover open rather.,1141,1433,818,0
2025-05-21,Wipro,Allison Campos,allenashley,Tax however consumer single his of hope child provide life color record most beyond record because.,3140,114,823,0
2024-03-03,Tata Motors,Dustin Jones,rpierce,Herself ever perhaps difficult certain generation century word capital sometimes majority.,555,47,535,0
2024-04-21,Tata Motors,Melissa Duffy,jacqueline16,Family blue than official join fact standard simple various light Mrs nature whatever nearly.,1032,281,207,0
2025-04-17,Adani Ports,Christopher Orozco,josephporter,Defense capital worker class career vote fast together.,2479,1311,360,1
2023-11-30,Adani Ports,Frank Choi,carolynmartinez,Race them song story offer across western view yet with soldier seat.,1219,1698,514,0
2025-03-14,Adani Ports,Rhonda Garcia,michael10,Despite carry stage thank event throughout interest friend stage positive itself machine see learn happen defense.,1031,1277,982,0
2023-11-02,Wipro,Clarence Barker,gregory94,Recently save page lose enough light social issue black house prevent rule send.,2649,1853,505,0
2025-06-30,HDFC Bank,Thomas Booker,vporter,Total wear home this sign present bag performance section television yourself.,4526,1030,588,0
2025-07-17,HDFC Bank,Tracy Alvarez,michellerivera,Shake hit population pick exactly factor wife fly feel reason American test both read offer second.,3390,184,706,0
2024-01-18,ICICI Bank,Steven Patton,brandon79,Opportunity inside reveal subject section any support until campaign read.,20,1444,580,0
2025-01-21,HDFC Bank,Dawn Montoya,millerashley,Foot common choice concern open discuss suffer box.,3030,1167,475,0
2025-07-28,Wipro,Gloria Edwards,alexandrawilliams,Up soldier one ready choose make almost side nice baby.,306,1946,94,0
2023-09-30,Infosys,Brenda Edwards,robertarnold,Military risk grow understand wear page test window another public trouble effort side before network.,1509,1345,867,0
2024-03-10,Adani Ports,Diamond Simon,amcdonald,Class company add movement next some from matter her practice mention whether relate her really.,1728,784,694,0
2024-08-25,ICICI Bank,Stacy Young,morganzachary,Training southern college price make professional end morning action collection tax page difficult.,4186,1017,516,0
2024-06-28,Adani Ports,Shirley Henson,martinezmichael,Let budget dinner book firm account long us throw throughout region can whom much represent.,2800,868,336,1
2024-10-20,Infosys,Christopher Donaldson,lauriemartinez,Kid player cause best grow much use boy let serious lawyer.,1439,1882,472,0
