date,company,advisor_name,username,post_text,likes,retweets,comments,label
2025-06-04,Wipro,Brooke Williams,richard83,Offer lot itself relationship job whose happy believe every sea reason generation food.,2841,1845,142,0
2024-03-25,Adani Ports,Debra Williams,vharris,Feel everybody indicate situation run any artist rest.,708,62,881,1
2025-04-13,Tata Motors,Kurt Smith,karenwilliams,Study decision difference particularly first simple benefit left there.,551,1839,392,1
2024-10-17,HDFC Bank,Tiffany Gardner,lori31,Agent note special security eye physical watch fish.,4863,187,950,0
2025-05-14,Tata Motors,Michael Todd,jenkinsangelica,Employee try indicate along several meeting red of family late.,1755,1718,874,0
2025-06-23,Tata Motors,Jacqueline Frank,maria91,Can skin magazine however become board environment.,1370,570,891,0
2024-03-13,ICICI Bank,Devin Hughes,victoriajohnson,Board hold ground paper enough many mother employee each true paper never.,4336,166,346,0
2024-05-17,Bharti Airtel,Kevin King,ashleybrandon,Tend system money present sea recognize ground.,360,1872,458,0
2025-07-07,ICICI Bank,Timothy Hodge,matthewcortez,Consumer president list adult pick quality western maybe nation participant history through.,211,1461,906,0
2024-07-05,Reliance,Sandra Bray,wendyschwartz,Always above almost me career explain cut whether election end finally want western ready plan this.,1468,316,475,0
2024-08-18,Wipro,Michele Spears,jessica79,Color keep various minute start despite our cause few.,2350,1103,492,0
2023-10-26,Adani Ports,Diana Burke,davidwebster,Home old thought expert usually truth within much some hit thousand better certain blood seven unit.,2572,1945,648,0
2023-12-15,Wipro,Spencer Ruiz,kimberlywagner,Or current about which respond human phone be suffer single speech course.,4764,900,387,1
2023-11-25,Reliance,Eugene Pierce,mariablair,Face have soon sea small institution several contain enjoy form wall medical require onto all apply.,2192,1560,309,0
2024-07-08,HDFC Bank,Michael Murphy,karenjones,Name compare mouth expect interview past family yes.,2023,270,735,0
2025-08-25,Tata Motors,Douglas Ramirez,christopherboone,Mrs culture student toward office majority off main lose way bill financial not.,3794,631,838,0
2025-06-16,Wipro,Casey Wood,lanejonathan,Consumer indicate join his employee several would since necessary explain thus bank particularly short.,3159,727,857,0
2024-10-05,Reliance,Tony Bullock,james78,Every fact evidence street use they sell face above return.,2280,232,52,0
2025-05-27,Infosys,Melissa Green,roseaaron,Suffer street center skill oil wish fly.,4765,529,66,0
2025-05-14,Reliance,Thomas Simmons,josephsmith,Build natural little represent cell program color your account mind generation entire area this central.,4860,58,743,0
2024-10-01,Bharti Airtel,Christina Harmon,kimberlyruiz,Interest enter safe score receive according black card condition almost effort street design physical performance.,1939,1153,729,1
2024-04-13,Infosys,Jennifer Ward,lorirussell,Page various dark think can eight personal thing.,2729,419,521,0
2024-10-23,HDFC Bank,Toni Payne,karenboyd,Board face analysis statement direction finish sort first whose fall this indicate personal this may attack.,3868,1449,837,0
2024-03-27,HDFC Bank,Savannah Anderson,gwright,Our science major system great here specific bed sell activity bad event add whom keep.,558,1541,737,0
2023-11-27,Infosys,Casey Roberson,gibsonlori,Prepare such much guess behind significant truth case.,3838,431,284,0
2025-09-06,HDFC Bank,Victoria Gonzalez,rickeyhernandez,According Mr project woman hotel animal above certainly.,3186,1026,469,1
2024-03-03,Wipro,Brandy Johnson,teresaromero,Yet list outside travel city might big military year receive idea site form.,445,1401,321,0
2025-07-06,HDFC Bank,Jeremy Walker,wayne46,Challenge personal simple majority her cell glass evening choice since.,4760,1449,112,0
2025-04-23,Adani Ports,Rita Singh,kristina55,Include cell describe religious size owner hold concern thus much poor within foot lose yet provide.,4645,801,311,0
2025-06-16,HDFC Bank,Laura Berger,uramirez,Reach happy food bring eat safe require war develop modern tough.,488,407,799,0
2025-02-14,ICICI Bank,Katelyn Johnson,brittany86,Language guess city fund card dream trial impact itself wrong alone happy.,131,1897,591,1
2023-10-14,Tata Motors,Kimberly Mitchell,lauren47,Surface discuss my sport foreign lay a Congress pay on throughout with.,2654,1245,957,0
2025-09-07,Bharti Airtel,Kevin Gutierrez,jacqueline46,Wrong cup look onto financial small boy just.,3589,1111,220,0
2024-02-03,ICICI Bank,Julie Hall,tfischer,Rather day information right should positive example guess training person beautiful.,3930,1455,425,0
2025-01-10,Tata Motors,Stephanie Marquez,johnsonmaria,Ten relationship national throughout until everything too call point activity Mr age including.,2233,136,958,0
2024-12-31,Adani Ports,Adam Jacobs,coxmelissa,Skin how woman film impact bring suddenly degree stand future maybe road admit open detail.,2114,973,16,0
2025-04-02,Tata Motors,Amanda Scott,randy63,Make head subject leader until challenge family few choose old company fine manager case.,189,923,503,0
2024-02-13,Bharti Airtel,Mrs. Alicia Robinson,umack,Free push real experience really dog never month price improve body property.,2822,315,859,0
2024-08-21,Wipro,Jessica Nunez,jacobpage,Father kind degree high record pattern grow can fly.,3609,617,401,0
2025-02-11,Reliance,Eric Cook,gonzalezdonald,Fact concern television soldier mouth soldier ready include magazine should stop within west.,159,1508,863,1
2023-09-21,Adani Ports,Kenneth Kennedy,daviesdiane,Two wish provide ability unit suggest road represent join.,1842,1767,116,0
2023-12-11,Wipro,Matthew Haynes,htaylor,Son weight yet impact few author resource military feeling save.,488,379,316,0
2023-10-13,Reliance,Stephanie Bennett,samuelarellano,Argue picture take task himself sport company record democratic hard by end threat somebody upon recognize.,240,148,307,0
2024-11-14,Reliance,Leah Hughes,yrobinson,Leg east our example run history itself civil check since wrong growth.,4905,78,990,0
2024-06-23,HDFC Bank,Miss Cassandra Vance,joseph37,According side morning arm next thank among scientist identify whole all safe effect audience.,3359,674,332,0
2024-09-18,HDFC Bank,Lynn Duran,ericrobinson,Play fund south game between into church here defense change knowledge head such.,2113,10,605,0
2024-02-27,Bharti Airtel,Renee Hudson,lowerymichael,Police later feeling record magazine enjoy medical suddenly while meeting section her indeed.,876,1315,747,0
2025-04-02,ICICI Bank,Christopher Rosales,nguyenbrent,Bag society would piece task fact Republican discussion piece material.,4394,771,98,1
2024-06-06,Tata Motors,Brandi Gonzales,james20,Suffer upon information capital enough music view international what collection forget order partner attorney.,3627,276,19,0
2023-12-31,Wipro,Daniel Lane,dmeyers,White bed significant court some energy stock.,954,427,841,1
2025-06-02,ICICI Bank,Ryan Ward,jeremy76,Choose participant leave gun simply out their charge must wide listen watch before city true.,2589,484,46,0
2025-07-07,HDFC Bank,Nicole Green,tonistewart,Eight consumer report report series seven respond campaign lay might technology resource good choose care project.,2111,457,326,0
2024-05-25,Adani Ports,Joseph Blackburn,lisa32,Young kitchen now ten shoulder figure hundred south quality treatment.,2914,1464,91,0
2024-10-10,Wipro,Zachary Molina,omartin,Production assume center onto course end computer material less business key class require.,4552,1187,523,0
2023-11-17,Infosys,Charles Kemp,floresbenjamin,Purpose total side family bit imagine whose hotel national foot culture western second reason.,3122,1326,973,0
2024-11-24,Infosys,Melissa Thomas,jonathan36,Trouble order listen water couple walk good left structure dream suggest attorney indicate key.,4066,1802,825,0
2024-07-30,Wipro,Mr. Andrew Walker,stevenhouston,Military sell lay common to talk tell of deep perform perform wish.,4774,151,275,0
2025-08-27,HDFC Bank,Andrea Gonzalez,jeffrey85,Friend above account free position game country anything quite after.,1236,292,840,0
2025-02-09,Bharti Airtel,Karla Cantrell,meghangraham,Teach budget card you mean respond standard try different civil.,4938,625,979,0
2024-12-16,Tata Motors,David Hall,timothyrobinson,Discuss consider but eat crime read material experience.,1565,735,753,0
2025-04-13,Bharti Airtel,Daniel Cook,robertcollins,Yard task project give outside success free development note paper stage report member event world popular.,3771,925,108,0
2024-06-24,ICICI Bank,Craig Carroll,jameslee,Believe worker speech hear oil need produce explain.,612,168,850,0
2024-11-12,Bharti Airtel,Krista Hunt,scott51,Long debate take itself health free other.,3053,1268,484,0
2024-09-05,Bharti Airtel,Regina Torres,halllonnie,Body represent part official specific action letter action strategy campaign five then popular in available.,2789,198,507,0
2025-04-28,HDFC Bank,Robert Collins,johnsonroberto,Station administration order necessary success discussion act then already high wide light red newspaper true.,2707,484,937,0
2025-07-10,Reliance,Kathryn Sexton,burnettcarl,Doctor claim paper hit maybe brother nation cell month real simple space similar.,2785,1109,161,0
2023-11-16,Bharti Airtel,Bryan Lowe,pittspatrick,Skill choose season ability live idea picture according create go go toward.,2680,1237,155,0
2023-09-28,Reliance,Trevor Brown,qcooper,Follow safe which discover candidate star cold.,2753,214,107,0
2025-07-21,Bharti Airtel,Michelle Scott,waltonnicole,Too produce coach war race benefit economy television past almost drug organization.,1486,120,168,0
2025-02-20,ICICI Bank,Aaron Garcia,bradleycarlos,Word happen successful poor city difficult pattern safe room future million notice room international.,4458,1233,352,0
2025-09-05,Reliance,William Dawson,tanner40,Drop increase plan research herself citizen could soon style effect drop.,3281,1891,568,0
2024-06-22,Bharti Airtel,Sherry Olsen,julie82,Allow radio each almost card third commercial piece recognize wall simple fine listen.,4653,1978,547,0
2024-09-01,Infosys,Melissa Hall,jameslong,Issue method responsibility finish upon until son onto candidate care government or born late participant send.,2970,288,427,0
2023-12-28,Reliance,Brenda Brooks,virginia39,Produce job form area go just mention cup indeed employee.,3908,288,306,0
2023-11-15,HDFC Bank,Kathleen Edwards,sherrymiller,Professional mother character some tonight sea major media development return almost this.,4535,46,632,0
2025-03-28,Tata Motors,Christopher Snyder,hopkinspeter,Hour customer skin else though lead those north newspaper necessary ten.,637,1096,765,0
2023-11-18,Adani Ports,Sean Murphy,hhughes,Cell from then professional method these what become gas challenge more among our me manager we.,1100,347,787,0
2024-10-11,Reliance,Jessica Perry,frivera,Green hold couple develop run dog ready establish heavy table think bed official.,1308,568,892,0
2023-10-23,ICICI Bank,Suzanne White,jaime95,Let pattern part cell person window shake professional money practice.,2532,166,638,0
2024-12-26,Tata Motors,Michael Walker,ashleyramirez,Cost benefit middle national away cost operation audience charge check break candidate.,3898,1245,789,0
2024-12-26,Bharti Airtel,Rachel Gonzalez,landrymelissa,Single you summer guess light third field if rich usually government.,4718,618,857,0
2024-10-01,Wipro,Kimberly Turner,kristin69,Wrong dream century could significant feeling series.,3229,1454,534,0
2025-01-30,Reliance,Helen Ferguson,spencerphilip,Attorney owner front adult job short simply imagine.,552,1866,445,0
2024-10-31,Bharti Airtel,Nicholas Martin,lisabailey,Institution left record it loss check act picture political career business.,1077,159,924,0
2023-10-19,Wipro,Rachael Gutierrez,amy73,Until look significant same sea have top majority long buy near worry half national line research.,4152,972,782,0
2024-12-09,Reliance,Jacqueline Page,shoffman,Measure likely bank despite plan difficult out adult travel adult claim interview.,3024,211,649,1
2024-09-23,Infosys,Debra Harrington,russellmoss,Institution your establish education necessary step step conference.,2645,239,891,1
2025-03-28,Adani Ports,Teresa Spencer,masonwilson,With two never town hospital trade federal whether control move garden oil.,4691,883,640,0
2023-11-21,ICICI Bank,Robert Foley,john60,Authority significant part health at national quality against blue choice sometimes job surface.,2925,1755,652,0
2024-10-23,Bharti Airtel,Charles Carroll,caitlinhill,Pick simply century key military item evening without offer small military actually serious read cell.,2220,1606,965,0
2025-05-12,Reliance,Kristina Walker,laurenreilly,Technology reason plan century popular thus may maintain.,3236,1862,731,0
2025-06-11,Infosys,Casey Brown,schmidtstephen,Artist light not television have affect language whatever dream.,2328,1778,384,0
2024-05-25,Tata Motors,Anthony Weaver,durhamdaniel,Conference place international language ground more admit idea.,2077,1926,104,1
2024-09-09,Infosys,Michael Perez,anthony61,Wall produce section just behavior start majority debate.,519,563,585,0
2024-08-16,Infosys,Mary Coleman,kruegerjeffery,Capital without history development because outside create green become goal fact.,4139,770,526,0
2023-12-21,Infosys,Brian James,mclaughlinlisa,Resource laugh participant best tend begin remember scientist nor.,4416,816,430,1
2024-01-11,Wipro,Donna Smith,montoyadavid,Situation moment month apply religious level be early represent nice money.,3057,758,920,0
2025-06-12,Reliance,Noah Fisher,jeangilbert,Little magazine center window money travel itself base significant top course long.,3438,537,120,0
2025-03-24,ICICI Bank,David Bright,sanchezrobert,Second during check which push sometimes receive I man culture or positive memory act.,1842,962,419,0
2024-11-30,HDFC Bank,Jill Little,walshkaren,Memory world argue piece gas because five whose deal.,2490,1056,14,0
2023-10-15,Tata Motors,Christopher Wright,mrose,Full we beat character pattern help action minute truth cost itself.,4008,409,751,0
2025-03-27,Infosys,Oscar Burke,susan97,Respond wind time all arrive no threat century purpose road president poor statement lot step.,4695,1313,256,0
2024-08-16,Wipro,Kathryn Nelson,wallslisa,Run evidence occur budget way tonight it account become young break.,3762,1794,547,1
2025-08-30,Wipro,Tracey Arnold,djackson,Professional space project better scene player other industry.,98,1686,619,0
2023-12-07,Bharti Airtel,Zoe Miller,ruth19,Upon fine your officer least fight compare campaign never young speak traditional open professional task example.,571,110,157,1
2024-10-27,Bharti Airtel,Maria Morse,aliciacoleman,Boy citizen that she compare modern smile edge policy challenge whole less whose build.,254,392,467,0
2025-08-30,Adani Ports,Heather Carter,hannah80,Color particularly give although often trade design low goal near gas wall government.,3946,892,607,0
2024-12-15,Bharti Airtel,Heather Johnson,tuckerroger,Congress traditional product until different by others difficult data six product federal product up page.,1033,1078,716,1
2025-04-11,HDFC Bank,Teresa Warren,shannonturner,Simply third need compare budget admit become heavy there employee hit major factor.,2745,1494,146,0
2024-01-27,Bharti Airtel,David Jones,meganriggs,Analysis his help lot onto so reveal.,3704,1018,36,1
2023-11-10,ICICI Bank,Joanne Johnson,pattersondale,Spring behavior should leg picture product audience finish.,4834,596,220,0
2023-10-24,Adani Ports,Charlotte Adkins,ernestcaldwell,Expert more feeling ability amount food mean arm identify.,3350,654,62,0
2024-12-12,ICICI Bank,Kim Berry,brandonrogers,House avoid face drug capital investment window best population simple.,750,1998,408,0
2024-07-06,ICICI Bank,Gabriela Whitney,gmckee,Ahead want sit travel reality spend nearly cost who compare.,4812,1192,776,0
2025-01-23,HDFC Bank,Joshua Davis,bryantgregory,Player best member seat clear on name.,701,1342,462,0
2025-04-09,Reliance,John Smith,stewartstephanie,Stand lead really become use politics understand each significant meet off off half test development use.,1281,655,908,1
2024-12-19,ICICI Bank,Amy Schwartz,strongrebecca,Mission begin politics interesting walk kind fact appear arm quite list approach apply talk.,4500,1611,65,1
2023-09-27,Wipro,Becky Shannon,taylorallen,Usually consumer now appear fund audience poor on eat race structure girl.,1398,292,348,0
2024-04-20,Reliance,Peggy Scott,lfoley,Actually state like game job late fill fly animal left hold.,2585,265,123,0
2025-08-03,Adani Ports,Henry Doyle,jade72,Daughter foot write central important trial analysis nature world window more meet long president audience floor.,2080,714,465,0
2023-09-28,Reliance,Eric Sosa,maryrodriguez,War ago a rise respond effort family focus area provide knowledge anything even.,4038,1555,38,0
2024-04-25,Reliance,Lisa Brown DDS,gpreston,Inside argue company against mind really tend machine study detail require.,3216,562,730,0
2024-05-06,Adani Ports,Ann Hughes,wgreen,Behind art sister rather language compare point road it discussion.,1509,942,434,0
2023-12-12,Wipro,Nicole Burke,patricia01,Support career exactly both north week find student official often sit staff not two hospital.,4029,907,716,0
2024-09-29,Bharti Airtel,Javier Diaz,cherrytommy,Interview film if stay investment hotel behind wait black get result.,2390,1299,893,0
2024-07-17,ICICI Bank,Matthew Walker,toddwilliams,Eat cell car article consumer mouth clear later artist parent tell left manager.,3304,588,892,0
2024-03-23,Bharti Airtel,Samantha Nelson,browningchristie,Community free computer race positive because benefit in list season election.,2355,791,298,0
2025-08-20,Infosys,Jennifer Peterson,smithrichard,Easy wait Mrs church particular value something west class.,4488,1275,283,0
2025-06-05,Adani Ports,Lisa Paul,adam39,Shake energy nature machine method some cost manage voice likely meeting decade affect serious may listen.,1479,380,325,1
2023-09-29,Infosys,Kristina Dudley,michaelafrank,Plant tree degree food national little station kind study avoid.,919,1521,259,1
2025-08-30,HDFC Bank,Anthony Bowers,kaitlin19,Interview become between improve TV against as more somebody north late debate surface ago system.,1324,241,475,0
2025-05-11,Adani Ports,Gregory Molina,reyesheather,Employee concern coach find citizen production history.,2214,608,224,0
2023-10-29,Bharti Airtel,Theodore Burns,kprince,Want special look see century floor coach feel feeling animal the north simple decade.,963,76,404,0
2024-06-30,HDFC Bank,Caitlyn Lambert,kevin50,Be worker film ability least bad this enter bring clear military rock away someone.,4428,1209,0,0
2025-03-20,Wipro,Tony Ward,rileysherman,Letter sell onto argue allow stock whole her adult degree.,3095,993,12,0
2025-03-28,HDFC Bank,Patrick Waters,cranecindy,Bill room read school air size language east finish anyone.,172,1786,587,0
2023-09-28,ICICI Bank,Michael Sanchez,john69,Sure peace international subject herself open idea sort soldier without term.,3491,1259,367,0
2024-10-24,Tata Motors,Steven Campos,nolancynthia,Everything old officer appear spring policy ahead player development field stage executive coach.,3588,689,26,0
2025-01-11,Adani Ports,Bradley Odonnell,lisahill,Ahead understand stay bring investment pick peace local must wrong account apply city order leave.,153,531,842,0
2023-10-04,Adani Ports,Kelly Sherman,contrerasjack,Perhaps beyond head magazine difference forward seek card go lay development year.,1652,854,400,0
2025-08-06,Bharti Airtel,Joseph Allen,snyderjason,Radio Mr history mean market thing federal.,1371,652,132,0
2024-10-20,Infosys,Matthew Navarro,tammyrussell,Ahead any check task opportunity begin evidence drive protect light learn hit yourself.,1284,976,172,0
2024-01-08,Adani Ports,Ronald Anderson,kara05,Training hope on do bed too reason first.,562,878,902,0
2025-05-05,ICICI Bank,Jeffrey Chavez,bakerwilliam,Prepare peace red ask else hotel yard threat sign this else tend place prove.,1323,158,147,0
2025-01-31,ICICI Bank,Jonathan Armstrong,bradpotter,Member create large wind event threat city strategy imagine economy north.,1518,1473,228,0
2024-11-19,Wipro,Kristie Smith,farrelllaura,Democratic reflect sound everybody rest box meet boy majority budget because arrive main.,1121,827,428,0
2024-05-08,Reliance,Dennis Chang,seanbennett,Successful suffer throughout cell boy tax project boy loss time push near history happen effect.,1359,467,400,1
2025-04-03,Bharti Airtel,Robert Burke,dirwin,True fish begin there this expect term.,1057,1109,539,0
2025-07-12,Adani Ports,Stephanie Rodriguez,melissa89,Arrive example arm fill teacher thus line trade.,2951,980,280,0
2025-08-19,Reliance,Colleen Hall,kellytucker,Hair boy feel north organization fly option such account beat low catch set.,2664,1876,879,0
2023-10-31,Wipro,Eric Smith,ohoffman,Already necessary effect high Congress ahead ever pressure according mission property themselves kind after.,1134,1569,212,0
2025-05-31,Bharti Airtel,Dorothy Key,megan64,Spend single interest wonder if series paper big only race game politics up.,2026,658,806,0
2024-08-18,ICICI Bank,Luke Chase,jameswhite,Central news specific idea how fund tax instead individual move political alone page career can.,3905,999,870,0
2024-03-19,Wipro,Bethany Nash,michaelwright,Listen contain yourself whom of experience success.,3165,940,259,0
2024-10-11,ICICI Bank,Brandon Copeland,thomasphillips,Increase describe suffer wonder ahead wait poor herself my drug good change site produce safe.,1371,1982,538,0
2024-04-14,Infosys,Joshua Hayes,hernandezdenise,Cell market leader address name inside relate.,480,1683,35,0
2024-02-05,Tata Motors,Tiffany Diaz,nicolebrown,For cold information size discussion property these move member close treat.,4092,1984,600,0
2024-08-06,Reliance,Joshua Thomas,yleonard,Detail way issue phone modern as first finally allow spend quite edge rock speech candidate.,1833,24,396,0
2025-08-26,Bharti Airtel,Julie Williams,stephaniejohnson,Bit also but accept guess or leg already peace always learn us system cell discussion.,691,829,22,0
2025-05-18,Infosys,Stacey Banks,adam71,Skin have individual them its into school responsibility begin even many candidate rock experience language.,1977,1310,822,0
2025-08-21,ICICI Bank,Christine Santiago,hughesjuan,Meet size north inside activity new book growth may young.,4775,1629,138,0
2024-06-05,Tata Motors,Stephen Deleon,andrewmason,Especially culture letter necessary whatever western next south detail college even song follow head of.,611,1450,73,0
2023-11-05,ICICI Bank,Tammy Lee,ithompson,Enjoy note goal care exist admit paper model pretty score window mind environment but in.,4887,1138,185,0
2025-06-11,HDFC Bank,Ryan Aguirre,sabrinale,Open eat feeling than seek amount hour property there success.,1559,369,387,1
2024-11-28,HDFC Bank,Thomas Serrano,rebeccamurphy,Head week small share list partner many medical hold suddenly next bag admit thank live.,2839,39,215,0
2024-04-30,HDFC Bank,Glen Thomas,xlong,Likely spend personal girl sea cost scientist program.,603,1085,448,0
2024-01-01,Bharti Airtel,Cheryl Gray,michelleerickson,Analysis ready body another suggest growth public reveal me matter audience.,1814,1844,819,0
2025-04-18,Infosys,Kathryn Klein,churchheather,Specific person dark include science executive staff music total expert the response listen a here.,4564,126,341,0
2024-01-22,ICICI Bank,Pamela Hamilton,hfigueroa,Relate soldier only rest others will anyone race those minute close.,3852,1896,417,0
2023-12-17,ICICI Bank,Tara Frazier,wellsjennifer,Deep commercial toward citizen customer represent general affect effect billion technology pick news spring just story.,3022,611,860,1
2025-06-10,Tata Motors,Leah King,hjohnson,Your senior nearly these create most any few key level many dog talk so huge else.,1761,1285,713,0
2024-01-09,ICICI Bank,Brittany Ramos,stephenleblanc,Onto movement establish but memory minute community none race meet benefit risk learn he town Mr.,1705,1933,396,0
2025-06-06,Reliance,Anne Lopez,crystalalvarado,Take day data never require set during black live director create almost glass member above.,859,850,739,0
2024-01-26,Adani Ports,Victoria Waters,williamjones,Cut marriage modern care teacher site may clearly north land determine small at choice work.,180,1456,430,0
2024-10-21,HDFC Bank,Jesus Lang,maxwell98,Less big amount inside identify interest cover consider represent common two.,370,153,334,0
2023-09-27,Tata Motors,Joel Mann,robertterry,Public drug new physical base fish still lawyer report like ten.,1742,1816,744,0
2024-09-10,Bharti Airtel,Jason Dixon,travis82,Goal attorney figure garden rule no way speech yes believe ten last stuff summer.,2666,1081,152,0
2023-11-07,Adani Ports,Regina Collins,ltaylor,Say real finish college leg school claim stop week reduce never specific radio.,496,1337,446,0
2024-02-17,ICICI Bank,Michael Gillespie,jason07,Various product official include call present always itself I news.,2278,1765,828,0
2024-12-27,Adani Ports,Joseph Freeman,sandovalnicholas,Professor value bad capital mother save quality always serious only.,847,623,271,1
2024-07-13,Adani Ports,Carlos Erickson,krystalboyd,Medical quality design over letter partner southern let ask grow learn fight team cultural peace education.,1626,816,75,0
2024-02-14,ICICI Bank,Daniel Simmons,gbrown,Join whether focus side big poor arm test wide discuss mention factor tell.,1919,1259,690,0
2025-05-27,Bharti Airtel,Edward James,jflores,With drop he range available speak keep admit wall early later cost color bit talk.,4671,794,696,0
2024-03-09,Reliance,Jennifer Watkins,kwall,Compare mother set note key claim building international.,1631,1130,241,0
